{"review_version":1,"session_id":"W-example","stage":"first_review","task":"task2","version_label":"v1","score_kind":"ai_training_estimate","confidence":"medium","estimated_band":{"low":6,"high":6.5},"rubric":{"rubric_id":"ielts-writing-public-descriptors","publisher":"IELTS","standard":"IELTS Writing Band Descriptors","version":"updated-2023","source_reference":"https://ielts.org/cdn/ielts-guides/ielts-writing-band-descriptors.pdf"},"criteria":[{"criterion":"TR","score_low":6,"score_high":6.5,"evidence_support":["Position is present."],"evidence_limit":["Development is uneven."],"anchors":[]},{"criterion":"CC","score_low":6,"score_high":6.5,"evidence_support":["Paragraphing is clear."],"evidence_limit":["Links are mechanical."],"anchors":[]},{"criterion":"LR","score_low":6,"score_high":6.5,"evidence_support":["Vocabulary is adequate."],"evidence_limit":["Precision varies."],"anchors":[]},{"criterion":"GRA","score_low":6,"score_high":6.5,"evidence_support":["Complex forms are attempted."],"evidence_limit":["Errors remain."],"anchors":[]}],"priority_issues":[{"tag":"TR_DEVELOPMENT","evidence":"One claim lacks support.","learner_action":"Add a specific example."}],"full_model_answer":null,"next_action":"Revise before viewing an alternative."}
